{
  "schemaVersion": 1,
  "id": "initiative-agent",
  "projectSlots": [
    {
      "id": "runtime_state_root",
      "type": "path",
      "default": ".agent",
      "maxLength": 120
    }
  ],
  "source": {
    "origin": "consumer-baseline",
    "internalUse": "authorized-private",
    "publicEligibility": "unknown",
    "transformation": "genericized-template"
  }
}
